Crop_Name,Stage,Instructions,Estimated_Days,Alert
Strawberry,Harvesting & Winter Care,"Harvest ripe strawberries when they are fully red, firm, and detach easily from the stem. Pick every 1-3 days during peak season. After harvest (for June-bearers), mow foliage down to 2-3 inches, thin plants, and fertilize (renovation). In late fall, apply a 4-6 inch layer of straw mulch to protect plants from winter cold.",60,Do not remove winter mulch until new growth begins in spring and the danger of hard frost has passed. Early removal can expose plants to damaging cold.
Leeks,Seed Sowing,"Sow leek seeds indoors 8-10 weeks before the last frost date for best results, or directly outdoors once soil is workable in spring. Plant seeds 1/4 inch deep, spacing 1 inch apart in trays or rows. Keep the soil consistently moist until germination.",7,Consistent moisture is critical for successful germination.
Leeks,Transplanting & Spacing,"When seedlings are pencil-thick (6-12 inches tall), harden them off for about a week. Transplant outdoors into trenches 4-6 inches deep, spacing plants 4-6 inches apart within the trench, with rows 12-18 inches apart. Gently backfill trenches partially.",7,Harden off seedlings gradually to prevent transplant shock.
Leeks,Hilling for Blanching,"As leeks grow, gradually backfill the trenches until they are level with the ground. Once filled, begin to mound soil up around the stems every 2-3 weeks, covering the white portion of the stem. This 'blanching' process produces long, tender, white shanks.",60,Avoid covering the actual leaves during hilling to allow for photosynthesis.
Leeks,Watering & Feeding,"Leeks require consistent moisture throughout their growing cycle; water deeply once or twice a week, especially during dry spells. Fertilize monthly with a balanced organic fertilizer or well-rotted compost to support strong growth.",90,"Inconsistent watering can lead to tough, stringy leeks."
Leeks,Harvesting,"Leeks are typically ready for harvest when their white shanks are at least 1 inch in diameter, usually 100-120 days from transplanting. Loosen the soil around the base with a garden fork and gently pull or dig them up.",100,"Harvest before hard freezes, though leeks can tolerate light frosts."
Mukunuwenna,Preparation & Planting,"Select a location with full sun to partial shade and well-draining, moist soil. Enrich the soil with compost. Plant 4-6 inch stem cuttings directly into the soil, ensuring at least one node is buried. Space them about 6 inches apart and water thoroughly.",7,"Use healthy, vigorous cuttings from a mature plant for best results."
Mukunuwenna,Watering & Establishment,"Keep the soil consistently moist but not waterlogged, especially during the first 2-3 weeks as the cuttings develop roots. Water daily in hot, dry weather. Mukunuwenna thrives in damp conditions.",14,Yellowing leaves can be a sign of overwatering; ensure good drainage.
Mukunuwenna,Fertilization & Weeding,"Once plants are established (around 3-4 weeks), apply a balanced organic liquid fertilizer or compost tea every 2-3 weeks to promote lush leafy growth. Regularly remove weeds to prevent competition for nutrients.",25,"Avoid high-nitrogen chemical fertilizers which can cause rapid, weak growth."
Mukunuwenna,Harvesting & Pruning,"Begin harvesting when the plants are about 6-8 inches tall, typically after 4-5 weeks. Regularly pinch or cut the top 3-4 inches of the stems. This encourages the plant to become bushier and yields a continuous harvest.",35,Frequent harvesting prevents the plant from flowering and the stems from becoming tough.
Mukunuwenna,Pest & Disease Management,Regularly inspect leaves for common pests like aphids or caterpillars. Remove them by hand or use a mild insecticidal soap spray. Ensure good air circulation by not overcrowding plants to prevent fungal diseases.,45,"As this is an edible green, strictly avoid using chemical pesticides."
